{
  "_schema_version": "1.0",
  "playlist_id": "pl_abc123",
  "version_hash": "sha256:8f14e45fceea1673",
  "source": "server",
  "created_at": "2026-07-09T10:00:00Z",
  "downloaded_at": "2026-07-09T10:05:00Z",
  "tracks": [
    {
      "id": "track_001",
      "url": "/music/track001.mp3",
      "filename": "track001.mp3",
      "sha256": "e3b0c44298fc1c149afbf4c8996fb92427ae41e4649b934ca495991b7852b855",
      "size_bytes": 1048576,
      "duration_seconds": 180,
      "title": "Canción 1"
    },
    {
      "id": "track_002",
      "url": "/music/track002.mp3",
      "filename": "track002.mp3",
      "sha256": "a7ffc6f8bf1ed76651c14756a061d662f580ff4de43b49fa82d80a4b80f8434a",
      "size_bytes": 2097152,
      "duration_seconds": 200,
      "title": "Canción 2"
    }
  ]
}
